{
  "status": "needs_work",
  "summary": "Compared the retained 1920 px source, rendered crop and diff for home-promotions. The four sourced product cards and their primary content are present, but the section header and carousel chrome do not match the source and the section diagnostic mismatch is 10.606%.",
  "issues": [
    "HOME-PROMOTIONS-01 high vertical layout: expected heading and 'Zobacz więcej' button top around y=66 with cards starting y=174; actual heading/button start around y=31 while cards remain at y=174. Restore the source 66 px top position without moving the card row.",
    "HOME-PROMOTIONS-02 high carousel controls: expected visible circular previous/next controls centered at the outer card edges and a horizontal progress track at the section bottom; actual crop omits the controls and bottom progress track. Restore source carousel chrome and clipping/z-index.",
    "HOME-PROMOTIONS-03 medium card imagery: expected first two product bags positioned approximately y=227..421 and third/fourth around y=213..429; actual first bags shift and scale upward/downward differently, producing strong interior silhouettes in the diff. Preserve the correct source attachments but match each card's image box, object-fit and object-position."
  ],
  "evidence": [
    ".factory-cache/autopilot/runs/2026-09-10T19-06-21-844Z-22492/comparison-1789346670154/home-active/comparison.json",
    ".factory-cache/autopilot/runs/2026-09-10T19-06-21-844Z-22492/comparison-1789346670154/home-active/home-promotions-reference.png",
    ".factory-cache/autopilot/runs/2026-09-10T19-06-21-844Z-22492/comparison-1789346670154/home-active/home-promotions-rendered.png",
    ".factory-cache/autopilot/runs/2026-09-10T19-06-21-844Z-22492/comparison-1789346670154/home-active/home-promotions-diff.png"
  ]
}
