{"status":"passed","summary":"Poprawiono kontrakt dowodów: wynik bramki home zapisano do istniejącego pliku uruchomienia. Bramka nadal przechodzi pomyślnie.","evidence":[".factory-cache/autopilot/runs/2026-09-10T19-06-21-844Z-22492/008-discovery-detail-home/gate-home.json",".factory-cache/figma/latest/manifest.json",".factory-cache/figma/latest/observations/index.json"],"issues":[]}