{"status":"needs_work","summary":"Completed and durably recorded all 12/12 pending home-active audit items. Geometry is healthy, but page ownership mismatch is 12.796% versus the 8.5% threshold. No implementation or source files were changed.","evidence":[".factory-cache/autopilot/runs/2026-09-10T19-06-21-844Z-22492/comparison-1789346670154/home-active/comparison.json",".factory-cache/autopilot/runs/2026-09-10T19-06-21-844Z-22492/audit-progress/58751f426784b007e333/items/d6b8e2266bff79ad9635b049cb73b45faf3679d337212fda38b806176d4c9724.json",".factory-cache/autopilot/runs/2026-09-10T19-06-21-844Z-22492/audit-progress/58751f426784b007e333/items/387764a855c1342128ed676ebe604596544cf328d46563085b3fd2c293fb05c1.json",".factory-cache/autopilot/runs/2026-09-10T19-06-21-844Z-22492/audit-progress/58751f426784b007e333/items/b7a2455530ea0f19f3590f20cc81acd34fc734989487e946cafd25251d90228c.json",".factory-cache/autopilot/runs/2026-09-10T19-06-21-844Z-22492/audit-progress/58751f426784b007e333/items/428252da91197a88454ca75c0806e335bba88acbd54fea078cf69d37b77307b1.json",".factory-cache/autopilot/runs/2026-09-10T19-06-21-844Z-22492/audit-progress/58751f426784b007e333/items/107da35f095f1f2f2a9e5b88a3a07b3cdc822351c7a99237591b1f22ca55319a.json",".factory-cache/autopilot/runs/2026-09-10T19-06-21-844Z-22492/audit-progress/58751f426784b007e333/items/4c8cab55901bae6dd58ebf49054e9952b0dfe686a046fd814e376d783f2a37c1.json",".factory-cache/autopilot/runs/2026-09-10T19-06-21-844Z-22492/audit-progress/58751f426784b007e333/items/a5e8c907bf448bb0922d4cfe6bdbdcb94f7c42e26b0664a97ef202e0e8439a6c.json",".factory-cache/autopilot/runs/2026-09-10T19-06-21-844Z-22492/audit-progress/58751f426784b007e333/items/d8c896267a19cf1296d7f409b12494f9ca1198f86cea5866d331d1c74f43d648.json",".factory-cache/autopilot/runs/2026-09-10T19-06-21-844Z-22492/audit-progress/58751f426784b007e333/items/d24144cabaee68a40284fb746f8edbc0e41ac9a9fcf78c745ae40ff9a3addd9a.json",".factory-cache/autopilot/runs/2026-09-10T19-06-21-844Z-22492/audit-progress/58751f426784b007e333/items/e78a43c6c333d3acc01fa3dcd0c7188b540d079ed22476a9b08bb9482eac5a36.json",".factory-cache/autopilot/runs/2026-09-10T19-06-21-844Z-22492/audit-progress/58751f426784b007e333/items/b7626855c3974ca5ba962c3db3a3e9034fde7ecd06d51e73c7640ea9a0a88681.json",".factory-cache/autopilot/runs/2026-09-10T19-06-21-844Z-22492/audit-progress/58751f426784b007e333/items/29518939af670b1e77b330c552e400f4c93a1a06c30626ebf84f7fafbb0c5b81.json",".factory-cache/autopilot/runs/2026-09-10T19-06-21-844Z-22492/108-audit-round-0-58751f426784b007e333-route-home-active/home-interaction-probe.json"],"issues":["Hero typography, CTA placement and slider controls differ from the source; benefits also use the wrong warranty icon and incorrect typography.","Crop selection omits source entries and active popovers. Promotions, bundles and recommended products lack carousel controls; bundle media and content layout materially diverge.","Catalogues, about, blog and knowledge sections retain substantial crop, spacing, typography or accordion-state defects documented in their checkpoints.","Responsive product and blog wrappers shift off-screen at 1440–375 px; mobile renders lose major content and 375 px retains one pixel of overflow.","Fresh isolated Chrome testing found no runtime errors, but crop items are plain links, quantities have no interactive controls, product carousels expose no controls, and the knowledge accordion permits multiple open panels without swapping state icons."]}