{"status":"passed","summary":"Careers source discovery is complete; the careers group gate passes. Snapshot remains partial globally as required.","evidence":[".factory-cache/figma/latest/sections/30-careers-heading.json",".factory-cache/figma/latest/sections/31-careers-vacancies.json",".factory-cache/figma/latest/sections/32-careers-application.json",".factory-cache/figma/latest/sections/33-shared-shop-cta.json",".factory-cache/figma/latest/content-map.json",".factory-cache/figma/latest/manifest.json",".factory-cache/autopilot/runs/2026-09-10T19-06-21-844Z-22492/009-discovery-detail-careers/careers-group-gate.json","docs/factory/project/SOURCE_CLARIFICATIONS.md"],"issues":["Application recipient, CV retention policy, CF7 form identity, and privacy-policy destination remain downstream configuration gaps recorded in SOURCE_CLARIFICATIONS.md.","Source title “Magazynier/aprzedawca” is preserved verbatim and flagged for editorial review."]}