{"status":"needs_work","summary":"Audyt route-catalogues ukończony: 3/3 pozycji zapisano trwale. Sekcja wizualna i responsywność wymagają poprawek; interakcje są zablokowane przez brak źródłowych PDF-ów i adresów czytnika.","evidence":[".factory-cache/autopilot/runs/2026-09-10T19-06-21-844Z-22492/audit-progress/58751f426784b007e333/items/48d1d7f68e68d405dac93de0c3919219880d90906ae5caaab08685a2389a3fc8.json",".factory-cache/autopilot/runs/2026-09-10T19-06-21-844Z-22492/audit-progress/58751f426784b007e333/items/dd2e36ee48557aa39f1abe51fc7b129e7b90631d52f274046ec3275b09949b26.json",".factory-cache/autopilot/runs/2026-09-10T19-06-21-844Z-22492/audit-progress/58751f426784b007e333/items/20efefdf6959311377f678c5ff678d63866e1d5621d24eafe1a74619c36b2c0f.json",".factory-cache/autopilot/runs/2026-09-10T19-06-21-844Z-22492/085-audit-round-0-58751f426784b007e333-route-catalogues/section-catalogues-downloads-audit.json",".factory-cache/autopilot/runs/2026-09-10T19-06-21-844Z-22492/085-audit-round-0-58751f426784b007e333-route-catalogues/responsive-audit.json",".factory-cache/autopilot/runs/2026-09-10T19-06-21-844Z-22492/085-audit-round-0-58751f426784b007e333-route-catalogues/interactions-audit.json",".factory-cache/autopilot/runs/2026-09-10T19-06-21-844Z-22492/085-audit-round-0-58751f426784b007e333-route-catalogues/interaction-browser-probe.json"],"issues":["VIS-CAT-001: ikony akcji są odtworzone w CSS zamiast używać dokładnych SVG z Figma i edytowalnych identyfikatorów ACF.","VIS-CAT-002: diff sekcji wynosi 10,93%; rozbieżności obejmują typografię i kompozycję teł obu kart, mimo poprawnej geometrii sekcji.","RESP-CAT-001: okładki zasłaniają nagłówki i etykiety akcji przy szerokościach 1024, 390 i 375 px.","RESP-CAT-002: sonda dla 375 px wykazuje 1 px poziomego overflow.","INT-CAT-001: cztery etykiety są nieaktywnymi elementami SPAN. Do przetestowania pobierania i nawigacji potrzebne są dwa rzeczywiste PDF-y oraz dwa zatwierdzone adresy czytnika."]}