{
  "status": "needs_work",
  "summary": "Compared the bundle-benefits reference, rendered and diff crops against the frozen content and current geometry. All four sourced labels are present and the outer geometry passes within 1 px, but icon and typography styling materially differ (11.521% crop mismatch).",
  "issues": [
    "PB-BENEFITS-001 | priority: high | property: benefit icons | expected: four distinct exact green outline SVGs (quality badge, delivery truck, price tag, package) | actual: every row uses the same text checkmark glyph | fix: render the source-exported editable SVG attachment for each corresponding benefit; do not substitute glyphs.",
    "PB-BENEFITS-002 | priority: medium | property: benefit typography and spacing | expected: heavier light-gray labels with the source icon-to-label spacing and row rhythm | actual: thinner green labels with tighter icon spacing | fix: match the source font weight/color and per-row alignment while preserving the passing wrapper geometry."
  ],
  "evidence": [
    ".factory-cache/autopilot/runs/2026-09-10T19-06-21-844Z-22492/comparison-1789346670154/product-bundle/comparison.json",
    ".factory-cache/autopilot/runs/2026-09-10T19-06-21-844Z-22492/comparison-1789346670154/product-bundle/bundle-benefits-reference.png",
    ".factory-cache/autopilot/runs/2026-09-10T19-06-21-844Z-22492/comparison-1789346670154/product-bundle/bundle-benefits-rendered.png",
    ".factory-cache/autopilot/runs/2026-09-10T19-06-21-844Z-22492/comparison-1789346670154/product-bundle/bundle-benefits-diff.png",
    ".factory-cache/figma/latest/sections/54-bundle-benefits.json"
  ]
}
