{"status":"needs_work","summary":"Home cards now use source-backed native Woo products and relationships. Geometry passes; visual QA is deferred to final audit at 11.529%.","evidence":["front-page.php","src/css/pages/_home.scss","acf-json/group_rudnikagro_home.json","acf-json/group_rudnikagro_product.json","scripts/factory/project/import-content.php","scripts/factory/project/commerce-probe.php","docs/factory/project/PLAN.md","docs/factory/project/STATUS.md","docs/factory/project/COMMERCE_PROBE.json",".factory-cache/autopilot/visual-1789313460517/summary.json",".factory-cache/autopilot/visual-1789313460517/home/comparison.json"],"issues":["Page mismatch remains 11.529%, above 8.5%.","comparison.progress.deferred is true and section geometry has no remaining failures; final audit must address the deferred visual differences."]}