{
  "status": "needs_work",
  "summary": "Audited the blog section against retained crops, source-backed native post fields, exact Figma card image bounds, image diagnostics, and measured section geometry.",
  "issues": [
    "BLOG-001 high card image geometry: expected each sourced photo at y=123 relative to the section, 467x315; actual photos start near y=85 and are about 469x336. Correct grid top spacing and image dimensions/object-fit. The recognizable source assets are correct; the mismatch is geometry/crop, not cosmetic raster noise.",
    "BLOG-002 high title typography/flow: expected the first title in three source lines and the second in two lines with larger/bolder metrics; actual first title collapses to two lines and all titles use smaller/tighter typography. Match source font metrics and card widths/line flow.",
    "BLOG-003 medium section header: expected the posts CTA near x=1156 y=16 at about 288x56; actual begins around x=1177 y=8 and is taller/shifted. Restore header alignment and spacing.",
    "BLOG-004 medium metadata/read links: expected dates around y=462 and read links around y=646; actual dates are roughly 11px high and downstream spacing differs because of the card geometry. Align metadata and sourced arrow SVGs to the reference.",
    "Outer geometry passes with +0.797px y and +0.094px height deltas; crop mismatch is 31.457%."
  ],
  "evidence": [
    ".factory-cache/autopilot/runs/2026-09-10T19-06-21-844Z-22492/comparison-1789346670154/home/comparison.json",
    ".factory-cache/autopilot/runs/2026-09-10T19-06-21-844Z-22492/comparison-1789346670154/home/home-blog-reference.png",
    ".factory-cache/autopilot/runs/2026-09-10T19-06-21-844Z-22492/comparison-1789346670154/home/home-blog-rendered.png",
    ".factory-cache/autopilot/runs/2026-09-10T19-06-21-844Z-22492/comparison-1789346670154/home/home-blog-diff.png",
    ".factory-cache/autopilot/runs/2026-09-10T19-06-21-844Z-22492/096-audit-round-0-58751f426784b007e333-route-home/source-context/section-bdf3431f64435d7b.json",
    ".factory-cache/figma/latest/sections/24-home-blog.json"
  ]
}
