{"status":"passed","summary":"Shared foundation is implemented and active locally: ACF-backed sticky header/footer, DM Sans bundle, native menus/routes, WooCommerce, and idempotent snapshot importer. Build, PHP lint, and HTTP runtime checks passed.","evidence":["acf-json/group_rudnikagro_global.json","functions/rudnikagro.php","partials/header.php","partials/footer.php","scripts/factory/project/import-content.php","docs/factory/project/CONTENT_IMPORT_PLAN.md","docs/factory/project/STATUS.md"],"issues":["Full page layouts are intentionally deferred to their route phases.","CF7 recipient/form configuration, WooCommerce payment/shipping/product data, legal/download destinations, and mobile source remain documented source gaps."]}